active,full_name,last_name,first_name,by-line,affiliation,relationship,formal,university_affiliation,department_or_organization,discipline,portrait,brief_bio,by_line,research_interests,,hometown
yes,Claudia Engel,Engel,Claudia,"Academic Technology Specialist, Anthropology",Spatial History Project,affiliate,Academic Technology Specialist,Stanford,Anthropology,Anthropology,placeholder.gif,"Claudia Engel is an Academic Technology Specialist and Lecturer at the Department of Anthropology. She holds a doctorate degree in Anthropology. Her work centers around the academic uses of technology. She has been involved in anthropological projects that explore and apply innovative technologies, including the use of iPads in anthropological field research or the use of linked open data for archaeological repositories. In recent years she has increasingly become involved in spatial analysis and GIS and teaches a course on ""Spatial Approaches in the Social Sciences."" Claudia is co-organizer of the Spatial and GIS Special Interest Group at Stanford.",,,,
yes,Geoff McGhee,McGhee,Geoff,"Creative Director for Media and Communications, Bill Lane Center for the American West",Spatial History Project,affiliate,Creative Director for Media and Communications,Stanford,Bill Lane Center for the West,,placeholder.gif,"Geoff McGhee develops online media at the Bill Lane Center for the American West. He collaborates with media partners, researchers and scholars to create interactive stories, data visualizations and analytical tools. A veteran of online news, he has worked at The New York Times and ABCNews.com, and in France at Le Monde Interactif, covering a wide range of stories from breaking and investigative news to features on history, art and culture.",,,,
yes,David Medeiros,Medeiros,David,"Geospatial Reference and Instruction Specialist, Earth Sciences Library",Spatial History Project,affiliate,Geospatial Reference and Instruction Specialist,Stanford,Earth Sciences Library,,placeholder.gif,"David Medeiros is the GIS Reference and Instruction specialist at the Stanford Geospatial Center where he provides individual GIS reference help as well as group instruction and training. He designs and presents a variety of GIS workshops on topics from Basic GIS, to Data Creation, Mobile Data Collection, and GIS Cartography. He oversees the day-to-day operation of the GIS lab, handling diverse data and technology needs, and supervises a team of student GIS staff. David collaborates and supports CESTA on a variety of GIS and cartography projects.",,,,
yes,Stace Maples,Stace,Maples,"Geospatial Manager, Earth Sciences Library",Spatial History Project,affiliate,Geospatial Manager,Stanford,Earth Sciences Library,,placeholder.gif,"As the Geospatial Manager at The Stanford Geospatial Center I provide support and collaboration to the Stanford research community in capturing and making sense of the “where” of their work. My work mapping the research interests of scholars has taken me from the beaches of Martha’s Vineyard, to Kurdish Northeastern Syria, to the most remote areas of the Mongolian/Chinese border. An archaeologist by training and a technologist by temperament, I am interested in all aspects of mapping, from the aerial imaging of archaeological sites using kites and balloons, to the development of platforms for the gathering of volunteer geographic information. I have over 18 years of experience using Geographic Information Systems and Geotechnology for research and teaching, with expertise in a broad range of geospatial and supporting software and hardware.",,,,
yes,Giovanni Svevo,Svevo,Giovanni,"Archeologist, Spatial History Project",Spatial History Project,affiliate,"Director, Associazione Nazionale Archeologi",University of Oregon,Associazione Nazionale Archeologi,Archeology,placeholder.gif,"Giovanni Svevo is a professional archaeologist with 15 years of work experience in archaeological excavation and research, primarily in the territory of Rome. Since 2010 he has been the national director of the Associazione Nazionale Archeologi (ANA), Italy’s main professional archaeologists association. In recent years he has specialized in the use of GPS/TPS technologies and GIS software, applying this knowledge to archaeological fieldwork, focusing on the use of GPS/GNSS handhelds in surveys and the integration of different sources of data in GIS environment. He is currently involved in the Forma Urbis Romae project working on two aspects: georeferencing Lanciani’s map on a modern base and organizing and digitizing archeological information on the map to integrate it into a geo-database.",,,,
yes,Sam Wineburg,Wineburg,Sam,"Faculty Researcher, Wallenberg Media Places",Wallenberg Media Places,affiliate,,Stanford,,,placeholder.gif,,,,,
yes,Caroline Winterer,Winterer,Caroline,"Director, Stanford Humanities Center",,affiliate,"Director and Anthony P. Meier Family Professor in the Humanities, Stanford Humanities Center",Stanford,,,placeholder.gif,"Caroline Winterer specializes in the intellectual and cultural history of eighteenth- and nineteenth-century America. She is the author of two books: *The Mirror Antiquity: American Women and the Classical Tradition, 1750-1900* (2007) and *The Culture of Classicism: Ancient Greece and Rome in American Intellectual Life, 1780-1910* (2002; pb 2004). She has also published articles in the *Journal of American History*, the *American Quarterly*, the *Journal of the Early Republic*, and *Modern Intellectual History*. She is the recipient of fellowships from the National Humanities Center, the Mellon Foundation, the Stanford Humanities Center, and the National Endowment for the Humanities. ",Caroline is Professor of History at Stanford University and currently serves as Director of the Stanford Humanities Center. ,,,
yes,Cameron Blevins,Blevins,Cameron,"Faculty Researcher, Spatial History Project",Spatial History Project,visiting researcher,,Rutgers University,History,History,placeholder.gif,Cameron Blevins is a PhD candidate studying digital and American history. His dissertation maps the geography of the U.S. postal system in the American West during the late-nineteenth century. Cameron is an active member of the digital humanities community at Stanford and beyond and can be found online at cameronblevins.org.,,,,
yes,Jon Christensen,Christensen,Jon,"Faculty Researcher, Spatial History Project",,visiting researcher,,UCLA,History,History,placeholder.gif,"Jon Christensen is a principal investigator for Crowdsourcing for Humanities Research. He is directing a project crowdsourcing a new environmental history of the San Francisco Bay Area with museums, libraries, archives, and other partners as part of the Year of the Bay in 2013. He also has directed the Critical Habitat project, which has examined the spatial history of ideas, narratives, science, and practices of conservation across multiple spatial and temporal scales in the American West. And he coordinated Tooling Up for Digital Histories, a collaboration between the Spatial History Project and the Computer Graphics Lab at Stanford University and others to compile, test, create, and share new tools for digital and spatial research in the humanities.",,,,
yes,Mark Algee-Hewitt,Algee-Hewitt,Mark,"Co-Director, Literary Lab",Literary Lab,faculty researcher,Assistant Professor of English,Stanford,English,English,placeholder.gif,"Mark Algee-Hewitt is an Associate Research Director of the Stanford Literary Lab. His interests lie in the application of quantitative analysis to long eighteenth-century and Romantic period literature and aesthetic theory. Through his work with the Literary Lab, and as a Mellon Postdoctoral Fellow at McGill University he has participated in and led a diverse range of projects, from computational topologies of eighteenth-century German literature, to studies of the discourse of human variation in contemporary anthropology. His current work seeks to map the emergence and dissemination of aesthetic concepts in eighteenth-century British literature.",,,,
yes,Keith Baker,Baker,Keith,"Faculty Researcher, Humanities + Design",Humanities + Design,faculty researcher,J.E. Wallace Sterling Professor in Humanities,Stanford,History,History,placeholder.gif,,,,,
no,Vincent Barletta,Barletta,Vincent,"Faculty Researcher, Humanities + Design",Humanities + Design,faculty researcher,Assoc. Professor of Iberian and Latin American Cultuers and of Comparative Literature,Stanford,"Comparative Literature, Iberian and Latin American Cultures",Portuguese Literature,placeholder.gif,,,,,
yes,Giovanna Ceserani,Ceserani,Giovanna,"Director, Humanities + Design",Humanities + Design,faculty researcher,Associate Professor of Classics,Stanford,Classics,Classics,placeholder.gif,"Giovanna Ceserani works on the classical tradition with an emphasis on the intellectual history of classical scholarship, historiography and archaeology from the eighteenth century onwards. She is interested in the role that Hellenism and Classics played in the shaping of modernity and, in turn, in how the questions we ask of the classical past originate in specific modern cultural, social and political contexts. Her book *Italy's Lost Greece: Magna Graecia and the making of modern archaeology* was published by Oxford University Press in 2012.  Her current book project concerns the emergence of modern histories of ancient Greece; she is now also writing on the transformations of antiquarianism in the eighteenth century and on modern travels to ancient lands. Her interest in travel is engaging new digital approaches with a focus on the Grand Tour for the Stanford digital humanities project *Mapping the Republic of Letters*.  ",Giovanna is Professor of Classics at Stanford University and the Faculty Director of Humanities + Design.,,,
yes,Gordon Chang,Chang,Gordon,"Co-Director, Chinese Railroad Workers of North America",Chinese Railroad Workers of North America,faculty researcher,Olive H. Palmer Professor in Humanities,Stanford,History,History,placeholder.gif,"Gordon Chang is Professor of History, Olive H. Palmer Professor in Humanities; Director, Center for East Asian Studies, Stanford University. His research focuses on the history of America-East Asia relations and on Asian American history. He is affiliated with the Center for Comparative Studies in Race and Ethnicity, the American Studies Program, International Relations Program, and the Center for East Asian Studies. He is particularly interested in the historical connections between race and ethnicity in America and foreign relations, and explores these interconnections in his teaching and scholarship. He is a recipient of both Guggenheim and ACLS fellowships, and has been a three-time fellow at the Stanford Humanities Center.",,,,
yes,Dan Edelstein,Edelstein,Dan,"Faculty Researcher, Humanities + Design",Humanities + Design,faculty researcher,Professor of French and Italian,Stanford,French and Italian,French Literature,placeholder.gif,"Dan Edelstein works primarily on eighteenth-century France, which also serves as a convenient launching pad for raids into the nineteenth and twentieth centuries, as well as the early modern period. His first book, [*The Terror of Natural Right: Republicanism, the Cult of Nature, and the French Revolution*] (Chicago: University of Chicago Press, 2009), examines how liberal natural right theories, classical republicanism, and the myth of the golden age became fused in eighteenth-century political culture, only to emerge as a violent ideology during the Terror. This book won the [2009 Oscar Kenshur Book Prize]. He recently published a second book entitled [*The Enlightenment: A Geneaology*] (Chicago: University of Chicago Press, forthcoming Dec. 2010), which explores how the idea of an Enlightenment emerged in French academic circles around the 1720's. He is currently working on two book projects: first, on the concept of ""counter-mythologies"" during the Enlightenment and in the aftermath of the French Revolution; and second, on the ""myth of the Revolution.""  ","Dan is Associate Professor of French and, by courtesy, of History. He is the Principal Investigator of Mapping the Republic of Letters.",,,
yes,Amir Eshel,Eshel,Amir,"Director, Poetic Media Lab",Poetic Media Lab,faculty researcher,Edward Clark Crossett Professor of Humanistic Studies and Professor of Comparative Literature,Stanford,German,Comparative Literature,placeholder.gif,,,,,
yes,Paula Findlen,Findlen,Paula,"Faculty Researcher, Humanities + Design",Humanities + Design,faculty researcher,Ubaldo Pierotti Professor of History,Stanford,History; French and Italian,History,placeholder.gif,"Paula Findlen teaches history of science before it was ""science"" (which is, after all, a nineteenth-century word). Her main interests are the scientific revolution, natural history before Darwin, and the history of medicine; her regional emphasis is on Italy in the age of Galileo. Professor Findlen received her Ph.D. from UC Berkeley and taught at the University of California, Davis and Harvard before coming to Stanford. She is the author of Possessing Nature: Museums, Collecting, and Scientific Culture in Early Modern Italy (Berkeley: University of California Press, 1994), which received the 1995 Howard Marraro Prize in Italian History and the 1996 Pfizer Prize for best book in History of Science. Her new book on women in early modern science entitled, The Daughters of Galileo: Knowledge and Desire at the End of the Scientific Revolution, will appear in 1998. Eventually she hopes to finish another project, When Science Became Serious. But she is trying not to be too serious about it...  ","Ubaldo Pierotti Professor of Italian History; Co-Director, Center for Medieval and Early Modern Studies; Principal Investigator, Mapping the Republic of Letters. ",,,
yes,Shelley Fisher-Fishkin,Fisher-Fishkin,Shelley,"Co-Director, Chinese Railroad Workers of North America",Chinese Railroad Workers of North America,faculty researcher,Joseph S. Atha Professor in Humanities,Stanford,,,placeholder.gif,"Shelley Fisher Fishkin is Joseph S. Atha Professor of Humanities, Professor of English, and Director of American Studies, Stanford University. She has taught at Stanford since 2003. She is the author, editor, or co-editor of over forty books, and has published over one hundred articles, essays and reviews, many of which have focused on issues of race and racism in America, and on recovering previously silenced voices from the past. Her books have won two “Outstanding Academic Title” awards from Choice, an award from the the National Journalism Scholarship Society, and “Outstanding Reference Work” awards from Library Journal and the New York Public Library. She holds a Ph.D. in American Studies from Yale. Before coming to Stanford, she was chair of the American Studies Department at the University of Texas at Austin.",,,,
yes,Zephyr Frank,Frank,Zephyr,"Director, CESTA, and Spatial History Project",Spatial History Project,faculty researcher,Professor of History,Stanford,History and Urban Studies,History,placeholder.gif,"Zephyr Frank is an Associate Professor of History at Stanford University, Director of the Spatial History Project, and the principal investigator for the Terrain of History project. This project is an international collaborative project that seeks to reconstruct and analyze the social, cultural, and economic spaces of nineteenth-century Rio de Janeiro. Professor Frank has been conducting this research for the last eight years.",,,,
yes,Deborah Gordon,Gordon,Deborah,"Faculty Researcher, Spatial History Project",Spatial History Project,faculty researcher,Professor of Biology,Stanford,Biology,Biology,placeholder.gif,"Deborah Gordon is a Professor in the Department of Biology at Stanford. Her research on the collective organization of ant colonies includes studies of the long-term demography and behavior of harvester ant colonies in Arizona; the factors that determine the spread of the invasive Argentine and in northern California; and the ecology of arboreal ants and ant-plant mutualisms in tropical forests in Central America. She is author of two books, Ants at Work (2000) and Ant Encounters:Interaction Networks and Colony Behavior (2010). She has been awarded the Gores Teaching Award from Stanford and fellowships from Guggenheim and the Center for Advanced Study in Behavioral Sciences.",,,,
yes,Allyson Hobbs,Hobbs,Allyson,"Faculty Researcher, Spatial History Project",Spatial History Project,faculty researcher,Assistant Professor of History,Stanford,History,History,placeholder.gif,"Allyson Hobbs is an assistant professor of American and African American history at Stanford. Currently, she is at work on a book manuscript that examines the phenomenon of racial passing in the United States from the late eighteenth century to the present. Allyson’s book is tentatively titled A Chosen Exile: A History of Racial Passing in American Life. The focus of her second book project will be migration, a different form of “crossing over” than passing and a major theme in African American and American history. The Great Migration was a watershed in African American life: over the course of six decades (1910-1970), six million black southerners left the South in search of more meaningful experiences of freedom. She hopes to offer a different angle of vision on the migration by bringing to light the places where migrants slept, ate, got haircuts, and danced along the way. She plans to recreate their routes, keeping the following questions in mind: how did the experience of migrating create, nurture, and solidify African American identities? What fractures, contradictions, and tensions within African American identities did the migration bring into relief? What kinds of resources did African Americans draw upon to navigate the constraints of Jim Crow America on the road?",,,,
yes,Nick Jenkins,Jenkins,Nick,"Faculty Researcher, Spatial History Project",Spatial History Project,faculty researcher,Associate Professor of English,Stanford,English,English,placeholder.gif,"Professor Nicholas Jenkins writes about and teaches 20th-century culture and literature, especially poetry. Jenkins is best known for his work on W.H. Auden, the 20th century Anglo-American poet. Jenkins has completed two projects on the poet. The first entails serving as the editor for a new critical edition of The Double Man, a 1941 collection of poems by Auden. The second is a title under contract with Harvard University Press called The Island: W.H. Auden and the Making of a Post-National Poetry. Jenkins has most recently created an interative website called Kindred Britain that grew out of his research on Auden. Kindred Britain is a customized database of nearly 30,000 individuals who are either British or have a familial relationship to a British person. Records in the database span the last 15 centuries and include a range of individuals from novelists to scientists to criminals to prime ministers. The website has been shortlisted for a 2013 Kantar Information is Beautiful Award which celebrates excellence in data visualization and information design.",,,,
yes,Ana Minian,Minian,Ana,"Facultry Researcher, Spatial History Project",Spatial History Project,faculty researcher,Assistant Professor of History,Stanford,History,,placeholder.gif,"Ana Raquel Minian is an Assistant Professor in the Department of History and the Center for Comparative Studies in Race and Ethnicity (CCSRE). Her current book project explores the late-twentieth-century history of Mexican undocumented migration to the United States, the growth of migrant communities, and bi-national efforts to regulate the border. It uses over two hundred oral history interviews, government archives, migrant correspondence, privately held organizational records and personal collections, pamphlets and unpublished ephemera, and newspapers and magazines collected in Washington D.C., Chicago, the San Francisco Bay Area, Los Angeles, Michoacán, Zacatecas, and Mexico City. As the first sustained history of transnational Mexican migration from 1965 to 1986, this work addresses audiences interested in U.S. and Latin American political history, Latina/o history, and Migration Studies. Minian is also working on a project on the United Farm Workers (UFW) union and another on Guatemalan transmigration through Mexico and into the United States.",,,,
yes,Franco Moretti,Moretti,Franco,"Director, Literary Lab",Literary Lab,faculty researcher,Danily C. and Laura Louise Bell Professor and Professor of Comparative Literature,Stanford,English and German,,placeholder.gif,"Author of Signs Taken for Wonders (1983), The Way of the World (1987), Modern Epic (1995), Atlas of the European Novel 1800-1900 (1998), Graphs, Maps, Trees (2005), The Bourgeois (2013), and Distant Reading (2013). Chief editor of The Novel (2006). Has founded the Center for the Study of the Novel and the Literary Lab. Writes often for New Left Review, and has been translated into over twenty languages.",,,,
yes,Tom Mullaney,Mullaney,Tom,"Faculty Researcher, Spatial History Project and Director, DH Asia","Spatial History Project, Humanities + Design",faculty researcher,Associate Professor of History,Stanford,History,,placeholder.gif,"Tom Mullaney is Associate Professor of Chinese History at Stanford. He is the author of Coming to Terms with the Nation: Ethnic Classification in Modern China and principal editor of Critical Han Studies: The History, Representation and Identity of China’s Majority. His second book project, tentatively titled The Chinese Typewriter: A Global History, examines China’s development of a modern, nonalphabetic information infrastructure encompassing telegraphy, typewriting, word processing, and computing. This project has received three major awards and fellowships, including the 2013 Usher Prize, a three-year National Science Foundation fellowship, and a Hellman Faculty Fellowship. The book is nearing completion. Tom is excited to partner with CESTA as he commences work on a new project on modern China.",,,,
yes,Clayton Nall,Nall,Clayton,"Faculty Researcher, Spatial History Project",Spatial History Project,faculty researcher,Assistant Professor of Political Science,Stanford,Political Science,,placeholder.gif,"Clayton Nall is an Assistant Professor of Political Science.  His research focuses on American political geography, with an emphasis on the role of the state and public policy in the creation of place-based interests.  Clayton's book manuscript, The Road to Inequality, examines how the largest public works project in US history created Republican suburbs, increased the urban-suburban political divide, and led to reduced investment in urban infrastructure.  The dissertation version of this manuscript won the Harvard Department of Government’s Toppan Prize for best dissertation in political science and the American Political Science Association's William Anderson Award for the best dissertation in the general field of federalism or intergovernmental relations, state and local politics.  Clayton's other research projects encompass public policy, causal inference, political geography, and American political development.  His peer-reviewed articles have appeared in the American Journal of Political Science, the Journal of Politics, Statistical Science, and The Lancet.",,,,
yes,Jonathan Rodden,Rodden,Jonathan,"Faculty Researcher, Spatial History Project",Spatial History Project,faculty researcher,Professor of Political Science and Senior Fellow at Hoover Institution,Stanford,Political Science,Political Science,placeholder.gif,"Jonathan Rodden is a professor in the political science department at Stanford who works on the comparative political economy of institutions. He has written several articles and a pair of books on federalism and fiscal decentralization. His most recent book, Hamilton’s Paradox: The Promise and Peril of Fiscal Federalism, was the recipient of the Gregory Luebbert Prize for the best book in comparative politics in 2007. He frequently works with the World Bank and the International Monetary Fund on issues related to fiscal decentralization. He has also written papers on the geographic distribution of political preferences within countries, legislative bargaining, the distribution of budgetary transfers across regions, and the historical origins of political institutions. He is currently writing a series of articles and a book on political geography and the drawing of electoral districts around the world. Rodden received his PhD from Yale University and his BA from the University of Michigan, and was a Fulbright student at the University of Leipzig, Germany. Before joining the Stanford faculty in 2007, he was the Ford Associate Professor of Political Science at the Massachusetts Institute of Technology.",,,,
yes,Edith Sheffer,Sheffer,Edith,"Faculty Researcher, Spatial History Project",Spatial History Project,faculty researcher,Assistant Professor of History,Stanford,History,,placeholder.gif,"Edith Sheffer is an Assistant Professor of modern European history at Stanford university. Interested in the global consequences of everyday actions, she is the author of Burned Bridge: How East and West Germans Made the Iron Curtain (Oxford Univ. Press, 2011). Her current book, Inventing Autism under Nazism: The Surveillance of Emotion and Child Euthanasia in the Third Reich, examines Hans Asperger’s creation of the autism diagnosis in Nazi Vienna, situating it within the context of efforts to define the national community and the murder of disabled children. Related research at the Spatial History Project, Forming Selves: The Creation of Child Psychiatry from Red Vienna to the Third Reich and Abroad, traces the transnational growth of the field of child development.",,,,
